{"billing_region":"global","conversion_table_ref":"not_applicable","conversion_table_sha256":"not_applicable","conversion_table_version":"not_applicable","currency":"USD","effective_from":"2025-04-14T00:00:00.000000Z","effective_to":"2030-01-01T00:00:00.000000Z","model":"gpt-4.1-mini-2025-04-14","product":"framework_openai_api","provider":"openai","rates":[{"rate_per_scale":"0.1","unit":"cached_input_token"},{"rate_per_scale":"0.4","unit":"input_token"},{"rate_per_scale":"1.6","unit":"output_token"}],"retrieved_at":"2025-04-14T00:00:00.000000Z","scale":1000000,"schema_version":"1.0.0","source_authority":"published_price_table","source_ref":"openai_pricing_20250414","source_sha256":"49dbdb97822473770a041158246311e9bd19069654606957c2877fcd60237c1c","tax_discount_credit_treatment":"excluded","unit":"token","version":"framework_openai_initial_20250414"}
